{
  "$schema": "http://json-schema.org/draft-07/schema#",
  "$id": "https://cpokuru.github.io/CoreRDK-Broadband-Platform/schemas/regional.schema.json",
  "title": "RDK-B Core Broadband Regional Applicability",
  "description": "Per-profile, per-region radio/power configuration and regulatory compliance status. Sibling file to memory-footprint/flash-layout/cpu-utilization, kept separate from hw-compat.schema.json so regional and certification status can change independently on their own timeline without touching the core spec. Core RDK-B defines the platform capability layer (see Hardware Compatibility Specification Section 9); actual certification is an OEM/operator product-program responsibility, so 'status' must never be marked certified/production-qualified without real evidence.",
  "type": "object",
  "required": ["profileId", "regionId", "regulatoryDomain", "radios", "compliance"],
  "properties": {
    "profileId": {
      "type": "string",
      "description": "Matches the profileId in the corresponding hw-compat.schema.json file for this profile."
    },
    "regionId": {
      "type": "string",
      "description": "Short region code, e.g. \"us\", \"ca\", \"eu\", \"uk\", \"in\", \"jp\", \"kr\", \"au-nz\", \"br\"."
    },
    "regionName": {
      "type": "string",
      "description": "Optional. Human-readable region name, e.g. \"North America (US)\"."
    },
    "regulatoryDomain": {
      "type": "string",
      "description": "Primary regulatory scheme/authority for this region, e.g. \"FCC\", \"ISED\", \"RED\", \"MTCTE\", \"ANATEL\", \"KC\", \"RCM\"."
    },
    "radios": {
      "type": "object",
      "description": "Regional radio band/power configuration. Not a substitute for certification evidence — describes what the platform is configured to do in this region.",
      "properties": {
        "wifi24GHz": {
          "type": "object",
          "properties": {
            "supported": { "type": "boolean" },
            "notes": { "type": "string" }
          }
        },
        "wifi5GHz": {
          "type": "object",
          "properties": {
            "supported": { "type": "boolean" },
            "dfsRequired": { "type": "boolean", "description": "True if Dynamic Frequency Selection is required for available channels in this region." },
            "notes": { "type": "string" }
          }
        },
        "wifi6GHz": {
          "type": "object",
          "properties": {
            "supported": { "type": "boolean" },
            "operatingModes": {
              "type": "array",
              "items": { "type": "string", "enum": ["LPI", "VLP", "SP"] },
              "description": "Regional 6 GHz operating modes: Low Power Indoor, Very Low Power, Standard Power (typically requires AFC)."
            },
            "afcRequired": { "type": "boolean", "description": "True if Automated Frequency Coordination is required for Standard Power operation in this region." },
            "notes": { "type": "string" }
          }
        }
      }
    },
    "power": {
      "type": "object",
      "description": "Optional. Regional power/adapter configuration.",
      "properties": {
        "adapterInput": { "type": "string", "description": "e.g. \"100-240 V AC, 50/60 Hz\"." },
        "plugType": { "type": "array", "items": { "type": "string" }, "description": "Regional plug/socket standard(s), e.g. [\"NEMA-1-15\", \"NEMA-5-15\"]." }
      }
    },
    "compliance": {
      "type": "array",
      "description": "One entry per applicable regulatory scheme for this region.",
      "items": {
        "type": "object",
        "required": ["scheme", "status"],
        "properties": {
          "scheme": { "type": "string", "description": "e.g. \"FCC\", \"ISED\", \"RED\", \"UKCA\", \"MTCTE\", \"ANATEL\", \"KC\", \"RCM\"." },
          "status": {
            "type": "string",
            "enum": ["not-tested", "pre-compliance", "certified"],
            "description": "Must not be 'certified' without a certificateId or equivalent evidence reference."
          },
          "certificateId": {
            "type": ["string", "null"],
            "description": "Certificate or test-report identifier. Required to be non-null when status is 'certified'."
          },
          "notes": { "type": "string" }
        }
      }
    },
    "notes": {
      "type": "string",
      "description": "Optional. Free-text notes on regional status or open items."
    }
  }
}
