{
  "$schema": "https://cpokuru.github.io/CoreRDK-Broadband-Platform/schemas/regional.schema.json",
  "profileId": "ext-easymesh",
  "regionId": "us",
  "regionName": "North America (US)",
  "regulatoryDomain": "FCC",
  "radios": {
    "wifi24GHz": { "supported": true },
    "wifi5GHz": { "supported": true, "dfsRequired": true },
    "wifi6GHz": { "supported": true, "operatingModes": ["LPI"], "afcRequired": false }
  },
  "power": {
    "adapterInput": "100-240 V AC, 50/60 Hz",
    "plugType": ["NEMA-1-15", "NEMA-5-15"]
  },
  "compliance": [
    { "scheme": "FCC", "status": "not-tested", "certificateId": null }
  ],
  "notes": "Starter regional file, US only. Illustrates the schema per Hardware Compatibility Specification Section 9.5; no radio configuration or compliance status below has been tested or certified. Other regions (Section 9.6) have not yet been profiled for this profile."
}
